{
  "agent": {
    "mode": "shape",
    "name": "shape-presenter"
  },
  "outputs": {
    "presentation_artifact_path": "run:artifacts/v-004/presentation.md",
    "presented_ac": "User can publish presentation markdown.",
    "summary_markdown": "Presentation ready."
  },
  "provenance": {
    "cli_command": "receipt seal",
    "run_id": "a1b2c3d4-e5f6-7890-abcd-ef1234567890",
    "source": "cli_seal",
    "step_id": "shape.present"
  },
  "receipt_id": "d70c9c3f-f26f-4fc6-b4ea-bfaa7fcbd0e4",
  "recommended_next_state": "shape.present",
  "run_id": "a1b2c3d4-e5f6-7890-abcd-ef1234567890",
  "schema_version": "2.2.0",
  "status": "completed",
  "timestamp": "2026-09-26T05:56:34Z"
}
