{
  "agent": {
    "mode": "engine",
    "name": "feature-builder"
  },
  "commands": [
    {
      "command": "foundry-stub:build",
      "exit_code": 0
    }
  ],
  "outputs": {
    "commands": [
      {
        "command": "foundry-stub:build",
        "exit_code": 0
      }
    ],
    "execution_graph_id": "porcelain-0007:execution-graph",
    "summary_markdown": "PROCEED: host build step recorded."
  },
  "provenance": {
    "cli_command": "receipt seal",
    "run_id": "a1b2c3d4-e5f6-7890-abcd-ef1234567890",
    "source": "cli_seal",
    "step_id": "execute.build"
  },
  "receipt_id": "050b9f56-f66c-4bf7-9144-b7b2193f2a96",
  "recommended_next_state": "execute.test",
  "run_id": "a1b2c3d4-e5f6-7890-abcd-ef1234567890",
  "schema_version": "2.2.0",
  "status": "completed",
  "timestamp": "2026-10-06T19:50:38Z"
}
