{
  "schema_version": "2.2.0",
  "receipt_id": "22222222-2222-4222-8222-222222222222",
  "run_id": "11111111-1111-4111-8111-111111111111",
  "timestamp": "2026-09-17T20:00:00Z",
  "agent": { "name": "story-writer", "mode": "implementation" },
  "status": "completed",
  "outputs": { "summary_markdown": "Acceptance criteria refined." },
  "provenance": {
    "source": "worker_launch",
    "run_id": "11111111-1111-4111-8111-111111111111",
    "launch_id": "33333333-3333-4333-8333-333333333333",
    "step_id": "intake.refine",
    "agent": "story-writer",
    "mode": "implementation",
    "branch_point": "main",
    "reviewed_head_sha": "aaaaaaaaaaaaaaaaaaaaaaaaaaaaaaaaaaaaaaaa"
  },
  "recommended_next_state": "intake.present_ac"
}
