{
  "agent": {
    "mode": "shape",
    "name": "intake-checker"
  },
  "outputs": {
    "summary_markdown": "Examination conversation complete."
  },
  "provenance": {
    "cli_command": "receipt seal",
    "run_id": "a1b2c3d4-e5f6-7890-abcd-ef1234567890",
    "source": "cli_seal",
    "step_id": "shape.examine"
  },
  "receipt_id": "749229a6-5d26-44d6-8761-981461eaac0b",
  "recommended_next_state": "shape.examine",
  "run_id": "a1b2c3d4-e5f6-7890-abcd-ef1234567890",
  "schema_version": "2.2.0",
  "status": "completed",
  "timestamp": "2026-09-26T05:46:27Z"
}
