{
  "agent": {
    "mode": "repair",
    "name": "repairer"
  },
  "commands": [
    {
      "command": "foundry-stub:test",
      "exit_code": 0
    }
  ],
  "outputs": {
    "commands": [
      {
        "command": "foundry-stub:test",
        "exit_code": 0
      }
    ],
    "summary_markdown": "PROCEED: host verification commands recorded.",
    "verification_policy": "implementation"
  },
  "provenance": {
    "cli_command": "receipt seal",
    "run_id": "a1b2c3d4-e5f6-7890-abcd-ef1234567890",
    "source": "cli_seal",
    "step_id": "execute.test"
  },
  "receipt_id": "750164c5-64c3-40d9-b41b-85798da9134f",
  "recommended_next_state": "execute.test.gate",
  "run_id": "a1b2c3d4-e5f6-7890-abcd-ef1234567890",
  "schema_version": "2.2.0",
  "status": "completed",
  "timestamp": "2026-10-06T19:50:38Z"
}
